{
  "toolchain_version": 1,
  "node": {
    "version": "22.22.1",
    "absolute_path": "/usr/local/bin/node"
  },
  "npm": {
    "version": "10.9.4"
  },
  "runtime_lock": {
    "file": "npm-shrinkwrap.json",
    "sha256": "9ffc39fa013a67517d95399c80759a4fd359ce1ab1ccc5ee0e957504796ab296",
    "packages": [
      {
        "name": "ajv",
        "version": "8.20.0",
        "integrity": "sha512-Thbli+OlOj+iMPYFBVBfJ3OmCAnaSyNn4M1vz9T6Gka5Jt9ba/HIR56joy65tY6kx/FCF5VXNB819Y7/GUrBGA=="
      },
      {
        "name": "base64-js",
        "version": "1.5.1",
        "integrity": "sha512-AKpaYlHn8t4SVbOHCy+b5+KKgvR4vrsD8vbvrbiQJps7fKDTkjkDry6ji0rUJjC0kzbNePLwzxq8iypo41qeWA=="
      },
      {
        "name": "better-sqlite3",
        "version": "12.10.0",
        "integrity": "sha512-CyzaZRQKyHkB2ZInfTTl2nvT33EbDpjkLEbE8/Zck3Ll6O0qqvuGdrJ45HgtH+HykRg88ITY3AdreBGN70aBSQ=="
      },
      {
        "name": "bindings",
        "version": "1.5.0",
        "integrity": "sha512-p2q/t/mhvuOj/UeLlV6566GD/guowlr0hHxClI0W9m7MWYkL1F0hLo+0Aexs9HSPCtR1SXQ0TD3MMKrXZajbiQ=="
      },
      {
        "name": "bl",
        "version": "4.1.0",
        "integrity": "sha512-1W07cM9gS6DcLperZfFSj+bWLtaPGSOHWhPiGzXmvVJbRLdG82sH/Kn8EtW1VqWVA54AKf2h5k5BbnIbwF3h6w=="
      },
      {
        "name": "buffer",
        "version": "5.7.1",
        "integrity": "sha512-EHcyIPBQ4BSGlvjB16k5KgAJ27CIsHY/2JBmCRReo48y9rQ3MaUzWX3KVlBa4U7MyX02HdVj0K7C3WaB3ju7FQ=="
      },
      {
        "name": "chownr",
        "version": "1.1.4",
        "integrity": "sha512-jJ0bqzaylmJtVnNgzTeSOs8DPavpbYgEr/b0YL8/2GO3xJEhInFmhKMUnEJQjZumK7KXGFhUy89PrsJWlakBVg=="
      },
      {
        "name": "decompress-response",
        "version": "6.0.0",
        "integrity": "sha512-aW35yZM6Bb/4oJlZncMH2LCoZtJXTRxES17vE3hoRiowU2kWHaJKFkSBDnDR+cm9J+9QhXmREyIfv0pji9ejCQ=="
      },
      {
        "name": "deep-extend",
        "version": "0.6.0",
        "integrity": "sha512-LOHxIOaPYdHlJRtCQfDIVZtfw/ufM8+rVj649RIHzcm/vGwQRXFt6OPqIFWsm2XEMrNIEtWR64sY1LEKD2vAOA=="
      },
      {
        "name": "detect-libc",
        "version": "2.1.2",
        "integrity": "sha512-Btj2BOOO83o3WyH59e8MgXsxEQVcarkUOpEYrubB0urwnN10yQ364rsiByU11nZlqWYZm05i/of7io4mzihBtQ=="
      },
      {
        "name": "end-of-stream",
        "version": "1.4.5",
        "integrity": "sha512-ooEGc6HP26xXq/N+GCGOT0JKCLDGrq2bQUZrQ7gyrJiZANJ/8YDTxTpQBXGMn+WbIQXNVpyWymm7KYVICQnyOg=="
      },
      {
        "name": "expand-template",
        "version": "2.0.3",
        "integrity": "sha512-XYfuKMvj4O35f/pOXLObndIRvyQ+/+6AhODh+OKWj9S9498pHHn/IMszH+gt0fBCRWMNfk1ZSp5x3AifmnI2vg=="
      },
      {
        "name": "fast-deep-equal",
        "version": "3.1.3",
        "integrity": "sha512-f3qQ9oQy9j2AhBe/H9VC91wLmKBCCU/gDOnKNAYG5hswO7BLKj09Hc5HYNz9cGI++xlpDCIgDaitVs03ATR84Q=="
      },
      {
        "name": "fast-uri",
        "version": "3.1.2",
        "integrity": "sha512-rVjf7ArG3LTk+FS6Yw81V1DLuZl1bRbNrev6Tmd/9RaroeeRRJhAt7jg/6YFxbvAQXUCavSoZhPPj6oOx+5KjQ=="
      },
      {
        "name": "file-uri-to-path",
        "version": "1.0.0",
        "integrity": "sha512-0Zt+s3L7Vf1biwWZ29aARiVYLx7iMGnEUl9x33fbB/j3jR81u/O2LbqK+Bm1CDSNDKVtJ/YjwY7TUd5SkeLQLw=="
      },
      {
        "name": "fs-constants",
        "version": "1.0.0",
        "integrity": "sha512-y6OAwoSIf7FyjMIv94u+b5rdheZEjzR63GTyZJm5qh4Bi+2YgwLCcI/fPFZkL5PSixOt6ZNKm+w+Hfp/Bciwow=="
      },
      {
        "name": "github-from-package",
        "version": "0.0.0",
        "integrity": "sha512-SyHy3T1v2NUXn29OsWdxmK6RwHD+vkj3v8en8AOBZ1wBQ/hCAQ5bAQTD02kW4W9tUp/3Qh6J8r9EvntiyCmOOw=="
      },
      {
        "name": "ieee754",
        "version": "1.2.1",
        "integrity": "sha512-dcyqhDvX1C46lXZcVqCpK+FtMRQVdIMN6/Df5js2zouUsqG7I6sFxitIC+7KYK29KdXOLHdu9zL4sFnoVQnqaA=="
      },
      {
        "name": "inherits",
        "version": "2.0.4",
        "integrity": "sha512-k/vGaX4/Yla3WzyMCvTQOXYeIHvqOKtnqBduzTHpzpQZzAskKMhZ2K+EnBiSM9zGSoIFeMpXKxa4dYeZIQqewQ=="
      },
      {
        "name": "ini",
        "version": "1.3.8",
        "integrity": "sha512-JV/yugV2uzW5iMRSiZAyDtQd+nxtUnjeLt0acNdw98kKLrvuRVyB80tsREOE7yvGVgalhZ6RNXCmEHkUKBKxew=="
      },
      {
        "name": "json-schema-traverse",
        "version": "1.0.0",
        "integrity": "sha512-NM8/P9n3XjXhIZn1lLhkFaACTOURQXjWhV4BA/RnOv8xvgqtqpAX9IO4mRQxSx1Rlo4tqzeqb0sOlruaOy3dug=="
      },
      {
        "name": "mimic-response",
        "version": "3.1.0",
        "integrity": "sha512-z0yWI+4FDrrweS8Zmt4Ej5HdJmky15+L2e6Wgn3+iK5fWzb6T3fhNFq2+MeTRb064c6Wr4N/wv0DzQTjNzHNGQ=="
      },
      {
        "name": "minimist",
        "version": "1.2.8",
        "integrity": "sha512-2yyAR8qBkN3YuheJanUpWC5U3bb5osDywNB8RzDVlDwDHbocAJveqqj1u8+SVD7jkWT4yvsHCpWqqWqAxb0zCA=="
      },
      {
        "name": "mkdirp-classic",
        "version": "0.5.3",
        "integrity": "sha512-gKLcREMhtuZRwRAfqP3RFW+TK4JqApVBtOIftVgjuABpAtpxhPGaDcfvbhNvD0B8iD1oUr/txX35NjcaY6Ns/A=="
      },
      {
        "name": "napi-build-utils",
        "version": "2.0.0",
        "integrity": "sha512-GEbrYkbfF7MoNaoh2iGG84Mnf/WZfB0GdGEsM8wz7Expx/LlWf5U8t9nvJKXSp3qr5IsEbK04cBGhol/KwOsWA=="
      },
      {
        "name": "node-abi",
        "version": "3.92.0",
        "integrity": "sha512-KdHvFWZjEKDf0cakgFjebl371GPsISX2oZHcuyKqM7DtogIsHrqKeLTo8wBHxaXRAQlY2PsPlZmfo+9ZCxEREQ=="
      },
      {
        "name": "once",
        "version": "1.4.0",
        "integrity": "sha512-lNaJgI+2Q5URQBkccEKHTQOPaXdUxnZZElQTZY0MFUAuaEqe1E+Nyvgdz/aIyNi6Z9MzO5dv1H8n58/GELp3+w=="
      },
      {
        "name": "prebuild-install",
        "version": "7.1.3",
        "integrity": "sha512-8Mf2cbV7x1cXPUILADGI3wuhfqWvtiLA1iclTDbFRZkgRQS0NqsPZphna9V+HyTEadheuPmjaJMsbzKQFOzLug=="
      },
      {
        "name": "pump",
        "version": "3.0.4",
        "integrity": "sha512-VS7sjc6KR7e1ukRFhQSY5LM2uBWAUPiOPa/A3mkKmiMwSmRFUITt0xuj+/lesgnCv+dPIEYlkzrcyXgquIHMcA=="
      },
      {
        "name": "rc",
        "version": "1.2.8",
        "integrity": "sha512-y3bGgqKj3QBdxLbLkomlohkvsA8gdAiUQlSBJnBhfn+BPxg4bc62d8TcBW15wavDfgexCgccckhcZvywyQYPOw=="
      },
      {
        "name": "rc/node_modules/strip-json-comments",
        "version": "2.0.1",
        "integrity": "sha512-4gB8na07fecVVkOI6Rs4e7T6NOTki5EmL7TUduTs6bu3EdnSycntVJ4re8kgZA+wx9IueI2Y11bfbgwtzuE0KQ=="
      },
      {
        "name": "readable-stream",
        "version": "3.6.2",
        "integrity": "sha512-9u/sniCrY3D5WdsERHzHE4G2YCXqoG5FTHUiCC4SIbr6XcLZBY05ya9EKjYek9O5xOAwjGq+1JdGBAS7Q9ScoA=="
      },
      {
        "name": "require-from-string",
        "version": "2.0.2",
        "integrity": "sha512-Xf0nWe6RseziFMu+Ap9biiUbmplq6S9/p+7w7YXP/JBHhrUDDUhwa+vANyubuqfZWTveU//DYVGsDG7RKL/vEw=="
      },
      {
        "name": "safe-buffer",
        "version": "5.2.1",
        "integrity": "sha512-rp3So07KcdmmKbGvgaNxQSJr7bGVSVk5S9Eq1F+ppbRo70+YeaDxkw5Dd8NPN+GD6bjnYm2VuPuCXmpuYvmCXQ=="
      },
      {
        "name": "semver",
        "version": "7.8.2",
        "integrity": "sha512-c8jsqUZm3omBOI66G90z1Dyw5z622G8oLG+omfsHBJf3CWQTlOcwOjvOG6wtiNfW6anKm/eA39LMwMtMez2TiQ=="
      },
      {
        "name": "simple-concat",
        "version": "1.0.1",
        "integrity": "sha512-cSFtAPtRhljv69IK0hTVZQ+OfE9nePi/rtJmw5UjHeVyVroEqJXP1sFztKUy1qU+xvz3u/sfYJLa947b7nAN2Q=="
      },
      {
        "name": "simple-get",
        "version": "4.0.1",
        "integrity": "sha512-brv7p5WgH0jmQJr1ZDDfKDOSeWWg+OVypG99A/5vYGPqJ6pxiaHLy8nxtFjBA7oMa01ebA9gfh1uMCFqOuXxvA=="
      },
      {
        "name": "string_decoder",
        "version": "1.3.0",
        "integrity": "sha512-hkRX8U1WjJFd8LsDJ2yQ/wWWxaopEsABU1XfkM8A+j0+85JAGppt16cr1Whg6KIbb4okU6Mql6BOj+uup/wKeA=="
      },
      {
        "name": "tar-fs",
        "version": "2.1.4",
        "integrity": "sha512-mDAjwmZdh7LTT6pNleZ05Yt65HC3E+NiQzl672vQG38jIrehtJk/J3mNwIg+vShQPcLF/LV7CMnDW6vjj6sfYQ=="
      },
      {
        "name": "tar-stream",
        "version": "2.2.0",
        "integrity": "sha512-ujeqbceABgwMZxEJnk2HDY2DlnUZ+9oEcb1KzTVfYHio0UE6dG71n60d8D2I4qNvleWrrXpmjpt7vZeF1LnMZQ=="
      },
      {
        "name": "tunnel-agent",
        "version": "0.6.0",
        "integrity": "sha512-McnNiV1l8RYeY8tBgEpuodCC1mLUdbSN+CYBL7kJsJNInOP8UjDDEwdk6Mw60vdLLrr5NHKZhMAOSrR2NZuQ+w=="
      },
      {
        "name": "util-deprecate",
        "version": "1.0.2",
        "integrity": "sha512-EPD5q1uXyFxJpCrLnCc1nHnq3gOa6DZBocAIiI2TaSCA7VCJ1UJDMagCzIkXNsUYfD1daK//LTEQ8xiIbrHtcw=="
      },
      {
        "name": "wrappy",
        "version": "1.0.2",
        "integrity": "sha512-l4Sp/DRseor9wL6EvV2+TuQn63dMkPjZ/sp9XkghTEbV9KlPS1xUsZ3u7/IQO4wxtcFB4bgpQPRcR3QCvezPcQ=="
      }
    ]
  },
  "lifecycle_hooks": [
    {
      "package": "better-sqlite3",
      "version": "12.10.0",
      "hook": "install"
    }
  ],
  "allowed_package_scripts": [
    "install"
  ],
  "javascript_clis": [
    {
      "name": "typescript",
      "version": "5.9.2",
      "integrity": "sha512-CWBzXQrc/qOkhidw1OzBTQuYRbfyxDXJMVJ1XNwUHGROVmuaeiEm3OslpZ1RV96d7SKKjZKrSJu3+t/xlw3R9A=="
    },
    {
      "name": "vitest",
      "version": "2.1.9",
      "integrity": "sha512-MSmPM9REYqDGBI8439mA4mWhV5sKmDlBKWIYbA3lRb2PTHACE0mgKwA8yQ2xq9vxDTuk4iPrECBAEW2aoFXY0Q=="
    },
    {
      "name": "eslint",
      "version": "9.18.0",
      "integrity": "sha512-+waTfRWQlSbpt3KWE+CjrPPYnbq9kfZIYUqapc0uBXyjTp8aYXZDsUH16m39Ryq3NjAVP4tjuF7KaukeqoCoaA=="
    },
    {
      "name": "typescript-eslint",
      "version": "8.20.0",
      "integrity": "sha512-Kxz2QRFsgbWj6Xcftlw3Dd154b3cEPFqQC+qMZrMypSijPd4UanKKvoKDrJ4o8AIfZFKAF+7sMaEIR8mTElozA=="
    }
  ],
  "build_inputs": [
    {
      "name": "@types/node",
      "version": "22.10.5",
      "integrity": "sha512-F8Q+SeGimwOo86fiovQh8qiXfFEh2/ocYv7tU5pJ3EXMSSxk1Joj5wefpFK2fHTf/N6HKGSxIDBT9f3gCxXPkQ=="
    },
    {
      "name": "@types/better-sqlite3",
      "version": "7.6.11",